{"verdict":"pass","summary":"feedback loop converged","findings":[],"tests_run":["workspace converged"],"follow_up":[],"capability_statuses":[{"name":"ordinary_program_execution","status":"pass","evidence":["workspace converged after verifier feedback"],"blocking_gaps":[],"required_closure":[]},{"name":"durable_native_substrate","status":"pass","evidence":["test fixture does not model substrate gaps"],"blocking_gaps":[],"required_closure":[]},{"name":"clasp_native_control_api","status":"pass","evidence":["feedback loop prompt included previous verifier feedback directly"],"blocking_gaps":[],"required_closure":[]},{"name":"orchestration_viability","status":"pass","evidence":["ordinary loop completed end to end"],"blocking_gaps":[],"required_closure":[]},{"name":"ergonomics","status":"pass","evidence":["test fixture did not expose ergonomic blockers"],"blocking_gaps":[],"required_closure":[]},{"name":"verification_gate","status":"pass","evidence":["workspace converged"],"blocking_gaps":[],"required_closure":[]}]}
