{"verdict":"fail","summary":"builder step failed before producing a durable report","findings":["/home/akul_medexfinance_com/clasp/.clasp-test-tmp/feedback-native-repro2.Xlo3lL/codex: line 23: .clasp-test-tmp/feedback-native-repro2.Xlo3lL/feedback-loop-workspace/workspace.txt: No such file or directory\n"],"tests_run":[],"follow_up":["Retry the failed step after inspecting its stderr artifact and persisted heartbeat."],"capability_statuses":[]}