{"verdict":"fail","summary":"workspace still needs feedback","findings":["workspace.txt still has the first-attempt content"],"tests_run":["workspace converged"],"follow_up":["Close the ordinary_program_execution category by using the verifier feedback to update workspace.txt."],"capability_statuses":[{"name":"ordinary_program_execution","status":"fail","evidence":["workspace.txt still has the first-attempt content"],"blocking_gaps":["builder did not consume the previous verifier feedback"],"required_closure":["Use the verifier feedback to update workspace.txt."]},{"name":"durable_native_substrate","status":"pass","evidence":["test fixture does not model substrate gaps"],"blocking_gaps":[],"required_closure":[]},{"name":"clasp_native_control_api","status":"pass","evidence":["direct Codex invocation path is present in the fixture"],"blocking_gaps":[],"required_closure":[]},{"name":"orchestration_viability","status":"fail","evidence":["loop has not converged yet"],"blocking_gaps":["builder/verifier cycle has not closed the blocking category"],"required_closure":["Make the next builder attempt consume the previous verifier feedback and converge."]},{"name":"ergonomics","status":"pass","evidence":["test fixture does not expose ergonomic blockers"],"blocking_gaps":[],"required_closure":[]},{"name":"verification_gate","status":"fail","evidence":["final convergence has not happened yet"],"blocking_gaps":["workspace still fails the acceptance check"],"required_closure":["Converge the workspace on the next attempt."]}]}
